Title,Content,Site-Name,Sector,Country
WDP: 4.5% Yielding Logistics REIT With An Anticipated 6% Earnings CAGR,"WDP: 4.5% Yielding Logistics REIT With An Anticipated 6% Earnings CAGR
WDP, a Belgian REIT, reported an earnings increase for 2023 and expects to increase earnings by over 20% by 2027. The REIT plans to invest €500 million per year for a cumulative total of €1.5 ...",Seeking Alpha,Logistics,Singapore
Earnings call: Pangaea Logistics reports a net income of $7.4 million,"Earnings call: Pangaea Logistics reports a net income of $7.4 million
Pangaea Logistics Solutions Ltd. (NASDAQ: NASDAQ:PANL) has reported an adjusted net income of $7.4 million for the fourth quarter of 2023 and $31.4 million for the full year, despite facing margin ...",Investing,Logistics,Singapore
Chemtrade Logistics Income Fund Declares March 2024 Distribution,"Chemtrade Logistics Income Fund Declares March 2024 Distribution
TORONTO, March 19, 2024--(BUSINESS WIRE)--Chemtrade Logistics Income Fund (TSX: CHE.UN) today announced that it has declared a cash distribution of $0.055 per unit for the month of March 2024 ...",Yahoo Finance,Logistics,Singapore
What's in Store for Pangaea Logistics (PANL) in Q4 Earnings?,"What's in Store for Pangaea Logistics (PANL) in Q4 Earnings?
Pangaea Logistics Solutions PANL is slated to release fourth-quarter 2023 results on Mar 13, after market close. The Zacks Consensus Estimate for fourth-quarter 2023 is currently pegged at an earnings of 44 cents per share, up 2.3% over the past 60 days.",雅虎財經,Logistics,Singapore
Q4 2023 Delek Logistics Partners LP Earnings Call,"Q4 2023 Delek Logistics Partners LP Earnings Call
Please go ahead. Rosy Zuklic Good day and welcome to the Delek Logistics Partners fourth-quarter earnings conference call. Participants on today's call will include Avoca direct President, Joseph Israel, EVP Operations, proving Spiegel, EVP and Chief ...",雅虎財經,Logistics,Singapore
Singapore shares little changed; STI falls 0.07%,"Singapore shares little changed; STI falls 0.07%
Find out more about subscription packages here. THE rally fuelled by the US Federal Reserve's commitment to cut rates did not carry over from Thursday (Mar 21), causing Singapore shares to close little changed on Friday despite overnight rally in the US ...",Business Times,Logistics,Singapore
Delek Logistics Partners (DKL) Q4 2023 Earnings Call Transcript,"Delek Logistics Partners (DKL) Q4 2023 Earnings Call Transcript
Please go ahead. Rosy Zuklic-- Vice President, Investor Relations and Market Intelligence Good day, and welcome to the Delek Logistics Partners fourth quarter earnings conference call ...",Yahoo Finance,Logistics,Singapore
JD Logistics Earnings: Non-IFRS Profit Beat Our Estimate Thanks to Cost Control; Shares Undervalued,"JD Logistics Earnings: Non-IFRS Profit Beat Our Estimate Thanks to Cost Control; Shares Undervalued
While JD Logistics', or JDL's, 2023 revenue was 1% lower than our estimate, the non-IFRS net profit was 88% higher than our forecast. The better earnings were attributable to faster-than ...",Morningstar,Logistics,Singapore
MAN Energy Solutions opens $30m mixed-purpose facility in Singapore,"MAN Energy Solutions opens $30m mixed-purpose facility in Singapore
...there are many ways you can work with us to advertise your company and connect to your customers. Our team can help you dight and create an advertising campaign, in print and digital, on this website and in print magazine. We can also organize a real ...",Singapore Business Review,Logistics,Singapore
"Saudi Arabia Chemical Logistics - Market Share Analysis, Industry Trends & Statistics, Growth Forecasts 2020 - 2029","Saudi Arabia Chemical Logistics - Market Share Analysis, Industry Trends & Statistics, Growth Forecasts 2020 - 2029
The ""Saudi Arabia Chemical Logistics - Market Share Analysis, Industry Trends & Statistics, Growth Forecasts 2020 - 2029"" report has been added to ResearchAndMarkets.com's offering. The Saudi Arabia Chemical Logistics Market size is estimated at USD 10.",Yahoo Finance,Logistics,Singapore
Closing Bell: Chemtrade Logistics Income Fund down on Monday (CHE-UN),"Closing Bell: Chemtrade Logistics Income Fund down on Monday (CHE-UN)
Chemtrade Logistics Income Fund opened trading today at $8.10 and closed at $8.04. It traded at a low of $7.98 to a high of $8.10. Share prices dipped -0.12 percent from the previous day's close ...",The Globe and Mail,Logistics,Singapore
"No record-high earnings for Singapore banks in 2024, but loans to recover","No record-high earnings for Singapore banks in 2024, but loans to recover
Photo by Jisun Han via Unsplash (cropped). Since you're here... ...there are many ways you can work with us to advertise your company and connect to your customers ...",Singapore Business Review,Logistics,Singapore
Pangaea Logistics Solutions Full Year 2023 Earnings: Misses Expectations,"Pangaea Logistics Solutions Full Year 2023 Earnings: Misses Expectations
Net income: US$26.3m (down 67% from FY 2022 ... We should say that we've discovered 2 warning signs for Pangaea Logistics Solutions that you should be aware of before investing here.",Yahoo Finance,Logistics,Singapore
Closing Bell: Chemtrade Logistics Income Fund down on Thursday (CHE-UN),"Closing Bell: Chemtrade Logistics Income Fund down on Thursday (CHE-UN)
In market activity today, shares of Chemtrade Logistics Income Fund opened at $7.98 and closed at $7.95. Intraday prices ranged from $7.91 to $7.99. Share prices dipped -0.62 percent from the ...",The Globe and Mail,Logistics,Singapore
Abrdn Euro Log Regulatory News,"Abrdn Euro Log Regulatory News
14th Mar 2024 12:06 pm GNW Form 8.3 - ABRDN European Logistics Income PLC 14th Mar 2024 11:24 am RNS Form 8 (DD) - abrdn European Logistics Income plc 14th Mar 2024 10:53 am GNW Form 8.3 - [abrdn ...",London South East,Logistics,Singapore
India's EAM Jaishankar discusses bilateral ties with Singapore leaders,"India's EAM Jaishankar discusses bilateral ties with Singapore leaders
Jaishankar arrived in Singapore on Saturday, the first day of his three-day visit. He addressed the Indian diaspora on Sunday and met with investors on Saturday. In addition to Balakrishnan ...",Business Line,Logistics,Singapore
When do you file your income tax in Singapore (2024)?,"When do you file your income tax in Singapore (2024)?
SINGAPORE - From 1 March to 18 April, you'll need to submit all your information to the Inland Revenue Authority of Singapore (IRAS) so that the amount of income tax you need to pay can be ...",Yahoo Finance,Logistics,Singapore
"Deliveroo beats earnings guidance, sees positive cash flow in 2024","Deliveroo beats earnings guidance, sees positive cash flow in 2024
Find out more about subscription packages here. BRITISH meal delivery company Deliveroo reported better-than-expected core earnings of £85 million (S$145.1 million) for 2023, and expected further progress during 2024 with a move into positive cash flow.",Business Times,Logistics,Singapore
Closing Bell: Chemtrade Logistics Income Fund up on Wednesday (CHE-UN),"Closing Bell: Chemtrade Logistics Income Fund up on Wednesday (CHE-UN)
Today, shares of Chemtrade Logistics Income Fund opened at $7.95 and closed at $8.00. It traded at a low of $7.93 to a high of $8.03. Shares raised 0.76% from the previous day's close of $7.94.",The Globe and Mail,Logistics,Singapore
Closing Bell: Chemtrade Logistics Income Fund up on Friday (CHE-UN),"Closing Bell: Chemtrade Logistics Income Fund up on Friday (CHE-UN)
Chemtrade Logistics Income Fund opened trading today at $7.95 and closed at $8.05. prices ranged from $7.93 to $8.06. Share prices advanced 1.26 percent from the previous day's close of $7.95.",The Globe and Mail,Logistics,Singapore
Results: China Aviation Oil (Singapore) Corporation Ltd Beat Earnings Expectations And Analysts Now Have New Forecasts,"Results: China Aviation Oil (Singapore) Corporation Ltd Beat Earnings Expectations And Analysts Now Have New Forecasts
So it's pretty clear that China Aviation Oil (Singapore) is expected to grow faster than the wider industry. The most important thing to take away is that the analysts downgraded their earnings ...",Yahoo Finance,Logistics,Singapore
Mapletree Logistics Trust: Eyes On Portfolio Optimization And China Exposure,"Mapletree Logistics Trust: Eyes On Portfolio Optimization And China Exposure
Mapletree Logistics Trust's second biggest market is China, but its logistics market in 2024 is unfavorable. Learn why I still have Hold rating for MAPGF REIT.",Seeking Alpha,Logistics,Malaysia
Blitz Raises Additional $1.6 Million in Oversubscribed Seed Extension Funding to Accelerate AI and EV Logistics Expansion Across Indonesia,"Blitz Raises Additional $1.6 Million in Oversubscribed Seed Extension Funding to Accelerate AI and EV Logistics Expansion Across Indonesia
JAKARTA, Indonesia, SINGAPORE and KUALA LUMPUR, Malaysia, March 19 ... focusing on maximising driver income and job security while reducing the logistics industry's carbon footprint. As Blitz rapidly expands within Indonesia and sets its sights on SEA ...",Yahoo Finance,Logistics,Malaysia
AWANI Review: Beyond Mail | Inside Pos Malaysia's Turnaround Story,"AWANI Review: Beyond Mail | Inside Pos Malaysia's Turnaround Story
Charles Brewer joined Pos Malaysia as CEO with a mission: to breathe new life into the national courier service. He outlines his strategy for adapting to the digital era, evolving from traditional mail services to comprehensive logistics and retail solutions.",Astro Awani,Logistics,Malaysia
On the right track for strong earnings,"On the right track for strong earnings
Logistics and port management companies are on track to post robust earnings on the strong recovery of Malaysia's trade performance, according to RHB Research.",The Star,Logistics,Malaysia
Expert: Widening of service tax exemption scope for logistics sector a good sign,"Expert: Widening of service tax exemption scope for logistics sector a good sign
The widening of the 6% service tax exemption scope for the logistics sector is vital for Malaysia's vision of becoming the Asean transshipment hub, opined Datuk Seri Dr Michael Tio.",The Star,Logistics,Malaysia
"New service tax increase is rational, says analyst","New service tax increase is rational, says analyst
Raising the tax from 6% to 8% is necessary to reduce government debt, but it should be implemented with minimal impact on the people.",Free Malaysia Today,Logistics,Malaysia
Mapletree Logistics Trust to buy Grade A warehouses in Malaysia and Vietnam for $234m,"Mapletree Logistics Trust to buy Grade A warehouses in Malaysia and Vietnam for $234m
The manager said the agreed value of the Malaysia logistics property in Kuala Lumpur ... is expected to generate an initial net property income (NPI) yield of some 5.7 per cent, the manager ...",The Straits Times,Logistics,Malaysia
"Mapletree Logistics Trust to spend S$234 million on Malaysia, Vietnam Grade A warehouse acquisitions","Mapletree Logistics Trust to spend S$234 million on Malaysia, Vietnam Grade A warehouse acquisitions
The manager said the agreed property value of the Malaysia logistics property in Kuala Lumpur represents ... last mile delivery - is expected to generate an initial net property income (NPI) yield of some 5.7 per cent, the manager said.",Business Times,Logistics,Malaysia
"NEW SERVICE TAX RATE REASONABLE, NO SHARP HIKE IN PRICES","NEW SERVICE TAX RATE REASONABLE, NO SHARP HIKE IN PRICES
To recap, SST is a single-stage tax imposed only on the sale of goods and services to end consumers. This taxation system was reintroduced by the government in 2018 after the six percent Goods and Services Tax (GST), which had been in effect since April 2015, was abolished.",bernama,Logistics,Malaysia
"Malaysia's trade to grow on global economic resilience, technology rebound cycle","Malaysia's trade to grow on global economic resilience, technology rebound cycle
RHB Investment Bank (RHB IB) has reiterated its sanguine view of Malaysia's trade outlook for 2024, buoyed by the resilience of global and",malaymail,Logistics,Malaysia
Kuehne + Nagel to Buy Asia-Pacific Logistics Provider City Zone Express,"Kuehne + Nagel to Buy Asia-Pacific Logistics Provider City Zone Express
but the acquisition will be immediately earnings-accretive and strategically enhance Kuehne + Nagel's cross-border road logistics service offerings in Asia, it said. Malaysia-based City Zone ...",MSN,Logistics,Malaysia
Cover Story 1: Preparing Capital A for take-off,"Cover Story 1: Preparing Capital A for take-off
This article first appeared in The Edge Malaysia Weekly on March 4, 2024 - March 10, 2024 PRIOR to running an airline, Tan Sri Tony Fernandes was known as an executive with an international recording company.",The Edge on MSN.com,Logistics,Malaysia
Buy Rating on Mapletree Logistics Trust: Resilience Amidst Chinese Market Challenges,"Buy Rating on Mapletree Logistics Trust: Resilience Amidst Chinese Market Challenges
Jonathan Koh, an analyst from UOB Kay Hian, maintained the Buy rating on Mapletree Logistics (MAPGF - Research Report). The associated",Business Insider,Logistics,Malaysia
"Tiger Logistics Announces Mega Plan in Line with PM Modi's Surya Ghar Scheme to Promote Sustainable, Renewable Energy","Tiger Logistics Announces Mega Plan in Line with PM Modi's Surya Ghar Scheme to Promote Sustainable, Renewable Energy
The company in February had also announced splitting of its shares in the ratio of 1:10 to increase public participation in the company's shareholding., Companies News - Times Now",timesnownews on MSN.com,Logistics,Malaysia
Live news: Cosco subsidiary cites weak global demand as profits plummet,"Live news: Cosco subsidiary cites weak global demand as profits plummet
The US will bring a UN security council resolution calling for an immediate ceasefire in Gaza of at least six weeks as part of a hostage deal for a vote on Friday, US officials said.",The Financial Times,Logistics,Malaysia
Kuehne+Nagel to acquire City Zone Express for $50mn,"Kuehne+Nagel to acquire City Zone Express for $50mn
Headquartered in Malaysia and established ... Zone Express will be immediately earnings-accretive and strategically enhance Kuehne+Nagel's cross-border road logistics service offerings in ...",air cargo,Logistics,Malaysia
1:10 Stock Split: Logistics Stock Declares Strategic Plan To Boost Presence In Energy Space,"1:10 Stock Split: Logistics Stock Declares Strategic Plan To Boost Presence In Energy Space
Ltd shares today hit lower circuit in trade today on BSE. Current market price of Tiger Logistics shares BSE is Rs 52.65 apiece.",Goodreturns,Logistics,Malaysia
Bursa ends higher spurred by bargain-hunting activities,"Bursa ends higher spurred by bargain-hunting activities
Bursa Malaysia rebounded from two consecutive days of declines to close higher today, spurred by bargain-hunting activities amid the recent market sell-off. Rakuten Trade Sdn Bhd vice-president of equity research Thong Pak Leng said key regional indices closed mostly higher,",Free Malaysia Today,Logistics,Malaysia
3 Singapore REITs increased their DPUs,"3 Singapore REITs increased their DPUs
MLT recently made headlines by acquiring three modern logistics properties in Malaysia and Vietnam. These properties boast a 96% occupancy rate and an initial net property income (NPI) yield of approximately 6.2%. According to the REIT's management ...",The Independent Singapore on MSN.com,Logistics,Malaysia
DPM Zahid: Revised MM2H requirements aim to attract more foreign participants,"DPM Zahid: Revised MM2H requirements aim to attract more foreign participants
The government has decided to amend several requirements for the Malaysia My Second Home (MM2H) programme to attract more foreign participants to",malaymail,Logistics,Malaysia
"Extra RM572mil spent after Pharmaniaga contract ended, says Dzul","Extra RM572mil spent after Pharmaniaga contract ended, says Dzul
Minister Dzulkefly Ahmad says pharmaceutical products cost up to five times more when purchased through tender.",Free Malaysia Today on MSN.com,Logistics,Malaysia
Live news: Russia targets Ukrainian energy in large-scale missile attack,"Live news: Russia targets Ukrainian energy in large-scale missile attack
Now the enemy is carrying out the largest-scale attack on the Ukrainian energy industry in recent times,"" said energy minister German Galushchenko. ""The goal is not just to damage, but to try again, like last year,",The Financial Times,Logistics,Malaysia
"FOREIGN INVESTMENTS WORTH RM281.5 BLN APPROVED IN 2022-2023 TO CREATE 98,725 JOBS","FOREIGN INVESTMENTS WORTH RM281.5 BLN APPROVED IN 2022-2023 TO CREATE 98,725 JOBS
KUALA LUMPUR, March 20 (Bernama) -- A total of 898 foreign investment projects valued at RM281.5 billion have been approved in the manufacturing and services sectors from 2022 to 2023, said Deputy Minister of Investment, Trade and Industry Liew Chin Tong.",bernama,Logistics,Malaysia
Live news: Belgian PM says EU leaders have demanded that violence in Gaza 'stops right now',"Live news: Belgian PM says EU leaders have demanded that violence in Gaza 'stops right now'
Belgian's prime minister said EU leaders have made ""extremely clear"" demands about the war in Gaza in statements agreed late on Thursday. ""We finally have a unified position that is extremely clear. Demanding that the violence stops right now .",The Financial Times,Logistics,Malaysia
"If You Invested $1000 in Reliance Steel a Decade Ago, This is How Much It'd Be Worth Now","If You Invested $1000 in Reliance Steel a Decade Ago, This is How Much It'd Be Worth Now
How much a stock's price changes over time is a significant driver for most investors. Not only can price performance impact your portfolio, but it can help you compare investment results across sectors and industries as well.",Yahoo Finance,Logistics,Malaysia
Covid-19 remembered: The oil palm business continuity,"Covid-19 remembered: The oil palm business continuity
Malaysia confronted the onset of Covid-19 pandemic, prompting the imposition of a nationwide movement control order (MCO) to curb the virus's spread.",The Star,Logistics,Malaysia
Current account surplus to improve in 2024,"Current account surplus to improve in 2024
Amid external headwinds, Malaysia is expected to see an improvement in the current account surplus this year after it substantially shrank to a mere 1.2% of gross domestic product (GDP) last year.",The Star,Logistics,Malaysia
15 Biggest Companies in Singapore,"15 Biggest Companies in Singapore
Despite that, the fixed income, currencies, and commodities business witnessed ... The company has an experience of over 30 years and operates in Australia, Singapore, the Bahamas, Malaysia, the Philippines, and the UK. As of March 22, Genting Singapore ...",Yahoo Finance,Logistics,Malaysia
Live news: Tory donor Frank Hester under police investigation,"Live news: Tory donor Frank Hester under police investigation
Hong Kong-listed shares in Chinese electric vehicle maker Li Auto dropped 7 per cent on Friday, after the Tesla rival slashed its January-March sales volume forecast due to lower-than-expected order intake.",The Financial Times,Logistics,Malaysia
REVISED MM2H REQUIREMENTS AIM TO ATTRACT MORE FOREIGN PARTICIPANTS - DPM AHMAD ZAHID,"REVISED MM2H REQUIREMENTS AIM TO ATTRACT MORE FOREIGN PARTICIPANTS - DPM AHMAD ZAHID
KLUANG, March 14 (Bernama) -- The government has decided to amend several requirements for the Malaysia My Second Home (MM2H) programme to attract more foreign participants to the country. Deputy Prim",bernama,Logistics,Malaysia
Top Two Spot Occupied By Indian Firms In FT's Asia Pacific Top 500 High-Growth List,"Top Two Spot Occupied By Indian Firms In FT's Asia Pacific Top 500 High-Growth List
South Korea emerged as the leader in the number of high-growth companies, boasting 123 firms, followed by Japan and Singapore, with 101 and 93 companies, respectively",abp LIVE on MSN.com,Logistics,Malaysia
Hyphens Pharma licenses Wynzora(R) Cream for ASEAN countries from MC2 Therapeutics,"Hyphens Pharma licenses Wynzora(R) Cream for ASEAN countries from MC2 Therapeutics
Cream for ASEAN countries from MC2 Therapeutics PR Newswire SINGAPORE, March 12, 2024 -- Wynzora(R) Cream is approved",MarketWatch,Logistics,Malaysia
Q4 2023 Ranpak Holdings Corp Earnings Call,"Q4 2023 Ranpak Holdings Corp Earnings Call
Ladies and gentlemen, thank you for standing by. My name is Debre, and I will be your conference operator today. I would like to welcome everyone to the Ranpak Fourth Quarter 2023 earnings call. (Operator Instructions) I would now like to turn the conference over to Sara Horvath, General Counsel. Please go.",Yahoo Finance,Logistics,Malaysia
Live news: European stocks slip from record high as FTSE 100 reapproaches peak,"Live news: European stocks slip from record high as FTSE 100 reapproaches peak
European stocks slipped from a record closing high, while London's FTSE 100 closed out its biggest weekly gain since September. The UK benchmark closed 0.6 per cent higher on Friday and now sits about 1 per cent below its record closing high from 13 months ago.",The Financial Times,Logistics,Malaysia
30 Countries With the Highest Purchasing Power Parity in the World,"30 Countries With the Highest Purchasing Power Parity in the World
In this article, we list and discuss the 30 Countries With The Highest Purchasing Power Parity in the World. If you would like to skip our detailed discussion of the topic, you can go directly to 10 Countries With The Highest Purchasing Power Parity in the World.",InvestingChannel on MSN.com,Logistics,Malaysia
Kuehne+Nagel operating profit cut 50% in 2023,"Kuehne+Nagel operating profit cut 50% in 2023
K+N's air logistics division recorded a 27% drop in fourth-quarter revenue, which was an improvement from the 41% decline for the full year. Earnings before interest and taxes were off 61% for 2023 and 52% in the quarter. Air volumes fell 11.2% while ...",freightwaves.com,Logistics,Malaysia
Live news: Shares of CK Asset Holdings fall while Henderson Land climbs,"Live news: Shares of CK Asset Holdings fall while Henderson Land climbs
The logistics group, a bellwether for global growth, forecast adjusted earnings of $17.25 to $18.25 a share for the fiscal year, up from a prior forecast made in December, when it warned demand was slowing. In its third quarter, FedEx reported $879mn in ...",The Financial Times,Logistics,Malaysia
"MLT announces proposed acquisition of Malaysia, Vietnam properties for $234 mil","MLT announces proposed acquisition of Malaysia, Vietnam properties for $234 mil
""Strategically located in logistics hubs serving the growing ... to 39.6% on a pro forma basis after financing the acquisitions. The Malaysia property is expected to generate an initial net property income (NPI) yield of approximately 5.7%, while the ...",The Edge Singapore,Logistics,Malaysia
Hyphens Pharma International Limited: Hyphens Pharma licenses Wynzora® Cream for ASEAN countries from MC2 Therapeutics,"Hyphens Pharma International Limited: Hyphens Pharma licenses Wynzora® Cream for ASEAN countries from MC2 Therapeutics
Wynzora® Cream is approved and marketed in Italy, Germany, Spain, the United Kingdom, and the United States.SINGAPORE, March 12, 2024 /PRNewswire/ -- Hyphens Pharma International Limited (""Hyphens",Finanznachrichten,Logistics,Malaysia
Vegetable wholesaler Farm Price gets nod for ACE Market listing,"Vegetable wholesaler Farm Price gets nod for ACE Market listing
Johor-based vegetable wholesaler Farm Price Holdings Bhd said on Wednesday it has secured regulatory approval for its listing on the ACE Market of Bursa Malaysia.  The approval marks another step forward for Farm Price's initial public offering since the company filed a draft prospectus on Oct 12,",The Edge on MSN.com,Logistics,Malaysia
China's Outbound Investment Reshaping The Global Economy,"China's Outbound Investment Reshaping The Global Economy
As economists obsess over plunging foreign direct investment into China, they risk missing a far more important trend: the giant waves of capital zo",Mena FN,Logistics,Malaysia
Here's How Much a $1000 Investment in Reliance Steel Made 10 Years Ago Would Be Worth Today,"Here's How Much a $1000 Investment in Reliance Steel Made 10 Years Ago Would Be Worth Today
How much a stock's price changes over time is a significant driver for most investors. Not only can price performance impact your portfolio, but it can help you compare investment results across sectors and industries as well.",Zacks.com on MSN.com,Logistics,Malaysia
"Tech: Forget chips, software and ecosystem are powering Nvidia","Tech: Forget chips, software and ecosystem are powering Nvidia
This article first appeared in The Edge Malaysia Weekly on March 4, 2024 - March 10, 2024 GLOBAL markets have more recently been about just one name: Nvidia Corp. ""As goes Nvidia, so go the markets"" became the common maxim.",The Edge on MSN.com,Logistics,Malaysia
"Top Glove, Eco World, Scientex Packaging, Yinson, FM Global, Kelington, Hibiscus, SCGM, Master Tec","Top Glove, Eco World, Scientex Packaging, Yinson, FM Global, Kelington, Hibiscus, SCGM, Master Tec
Here is a brief recap of some business news and corporate announcements that made the headlines on Wednesday:  Top Glove Corp Bhd's net loss for the second quarter ended Feb 29, 2024 narrowed to RM51.",The Edge on MSN.com,Logistics,Malaysia
Röhlig Logistics - preliminary 2023 numbers,"Röhlig Logistics - preliminary 2023 numbers
Bremen, 27 February, 2024 - Thanks to the acquisition of new customers and the corresponding increase in orders, the owner-managed logistics company Röhlig ... market situation and have thus expanded our earnings very solidly compared to the pre ...",The Loadstar,Logistics,Malaysia
