Title,Content,Site-Name,Sector,Country
"SREITs' retail, office, hospitality saw strong recovery in Q4 2023: analyst","SREITs' retail, office, hospitality saw strong recovery in Q4 2023: analyst
Hospitality and retail will continue to benefit from visitor arrivals and domestic spending. The last three months of 2023 shaped up to be a quarter of recoveries for Singaporean REITs. S-REITs saw their retail,",Singapore Business Review on MSN.com,Logistics,Singapore
Vietnam continues to be ASEAN highlight,"Vietnam continues to be ASEAN highlight
Recovering consumption and production in addition to stronger global goods demand are expected to help Vietnam achieve the highest growth in ASEAN this year.",Vietnam Investment Reviev,Logistics,Singapore
"Business News Highlights: Stock Markets End In Red, Sensex Settles At 73,502, Nifty Closes 150 Points Lower","Business News Highlights: Stock Markets End In Red, Sensex Settles At 73,502, Nifty Closes 150 Points Lower
Commenting on behalf of the EFTA bloc, made up of Singapore, Norway, Iceland ... Indian edtech start-up Byju's also released the full salary of 25 per cent of its employees, sources revealed. The employees who received the whole salary belonged to ...",ABP Live on MSN.com,Logistics,Singapore
Here's How Much a $1000 Investment in Reliance Steel Made 10 Years Ago Would Be Worth Today,"Here's How Much a $1000 Investment in Reliance Steel Made 10 Years Ago Would Be Worth Today
How much a stock's price changes over time is a significant driver for most investors. Not only can price performance impact your portfolio, but it can help you compare investment results across sectors and industries as well.",Zacks.com on MSN.com,Logistics,Singapore
Vegetable wholesaler Farm Price gets nod for ACE Market listing,"Vegetable wholesaler Farm Price gets nod for ACE Market listing
Johor-based vegetable wholesaler Farm Price Holdings Bhd said on Wednesday it has secured regulatory approval for its listing on the ACE Market of Bursa Malaysia.  The approval marks another step forward for Farm Price's initial public offering since the company filed a draft prospectus on Oct 12,",The Edge on MSN.com,Logistics,Singapore
"Sri Lanka's deal with Thailand could open doors to 'greater trade', in boost for debt-stricken economy","Sri Lanka's deal with Thailand could open doors to 'greater trade', in boost for debt-stricken economy
The free trade pact offers tariff concessions over a 15-year period, and could be a catalyst for Sri Lanka's objective of joining the RCEP It could also be a signal to Asean that South Asian countries like Sri Lanka are ready for more connectivity and economic engagement,",South China Morning Post on MSN.com,Logistics,Singapore
Budget lacked fresh vision for Hong Kong's economic future,"Budget lacked fresh vision for Hong Kong's economic future
Readers discuss the shortcomings of the 2024-25 budget, how housing affects the birth rate, and schools' approach to discussion of sex and dating Feel strongly about these letters, or any other aspects of the news?",South China Morning Post on MSN.com,Logistics,Singapore
How specialised REITs can transform Zim economy,"How specialised REITs can transform Zim economy
These specialised vehicles cater to niche, unique, and unconventional segments of the real estate market, providing unique opportunities for both investors and operators to diversify their portfolios.",The Zimbabwe Independent on MSN.com,Logistics,Singapore
The Esquire Trailblazers List 2024: 60+ Movers and Shakers in the Philippine Startup Ecosystem,"The Esquire Trailblazers List 2024: 60+ Movers and Shakers in the Philippine Startup Ecosystem
There's no shortage of talent within the startup ecosystem in the Philippines. Here are some who have made noteworthy strides and achievements over the past year.",Esquire Philippines on MSN.com,Logistics,Singapore
How do I know if I'm entitled to retrenchment benefits?,"How do I know if I'm entitled to retrenchment benefits?
Employers also need to consider staff morale, operational needs, reputation, business stability and logistics in determining whether to lay off staff right after announcing plans to wind up, or delay the retrenchment for some time after the announcement.",Her World,Logistics,Singapore
Starwood Capital and ESR co-founders take 10.7% stake in ESR Group,"Starwood Capital and ESR co-founders take 10.7% stake in ESR Group
ESR Group has around $156 billion in total assets under management focused on the new economy sectors of logistics, data centres and alternatives, across Asia Pacific.",FinanceAsia,Logistics,Singapore
The Countries With The Most Billionaires,"The Countries With The Most Billionaires
What determines the number of billionaires in each country is a mixture of factors, including the political stability of the country, the economic development, the regulatory environment, and the investment opportunities.",staplerconfessions on MSN.com,Logistics,Singapore
Couple draws flak for wanting helper to sit in economy but help with kids in business class,"Couple draws flak for wanting helper to sit in economy but help with kids in business class
The mother said her two children under two and ""really need the extra space"" at business class but also need their helper's help during meals.",The Independent Singapore on MSN.com,Logistics,Singapore
Starwood affiliate Sequoia Investco acquires 10.6% stake in ESR from investors of Redwood Investment Company,"Starwood affiliate Sequoia Investco acquires 10.6% stake in ESR from investors of Redwood Investment Company
The AUM is largely focused on New Economy assets such as logistics ... up among Singapore blue chips The transaction will see Starwood Capital commit approximately US$850 million through Starwood Opportunity Fund XII and Starwood Real Estate Income ...",The Edge Singapore,Logistics,Singapore
Investors urged to allocate more and get boots on the ground in Asia,"Investors urged to allocate more and get boots on the ground in Asia
The economic fundamentals of Asia dictate that asset owners should lift their allocations to the region, and a panel at the Fiduciary Investors Symposium - including chief of APG in the region - heard the best way to exploit the emerging opportunities is to have investment professionals on the ground.",top1000funds.com,Logistics,Singapore
Philippines VC Firm Kaya Founders Hits P1 Billion in Second Close of 2 Funds,"Philippines VC Firm Kaya Founders Hits P1 Billion in Second Close of 2 Funds
Kaya Founders has raised a total of P1 billion (about $18 million) after the close of its two latest funds, allowing it to support the growth of more early-stage startups not just in the Philippines but across Southeast Asia. The venture capital fund says its total assets under management is now at P1.25 billion ($22.5 million).",esquiremag on MSN.com,Logistics,Singapore
Lenskart Success Story and Business Model,"Lenskart Success Story and Business Model
Lenskart Success Story - Explore how Lenskart generates revenue and sustains its business model, shedding light on its strategies for profitability and market success.",moneyexcel.com,Logistics,Singapore
"Foreign investments worth RM281.5b approved in 2022-2023 to create 98,725 jobs in Malaysia, says deputy minister","Foreign investments worth RM281.5b approved in 2022-2023 to create 98,725 jobs in Malaysia, says deputy minister
Liew said that Malaysia currently possesses advantages such as good logistics ... are working in Singapore as gig workers. So the issue we have to resolve for creating more jobs or developing more skilled workers is to raise the salary levels in the ...",malaymail,Logistics,Singapore
Generali and UNDP are building SME resilience in Asia,"Generali and UNDP are building SME resilience in Asia
Launch of joint research on MSME resilience in Southeast Asia, and a focus on Malaysia and Thailand, detailing key risks and alternative approaches to insurance Presentation of the SME Loss Prevention Framework,",thearabianpost on MSN.com,Logistics,Singapore
Hierarchy system discourages FDI in Bangladesh: discussion,"Hierarchy system discourages FDI in Bangladesh: discussion
Speakers at a discussion on Monday said different stages of a hierarchy system discouraged foreign direct investment in",New Age,Logistics,Singapore
Manuka Health Limited leverages VerifyMe QR codes to participate in Amazon Transparency,"Manuka Health Limited leverages VerifyMe QR codes to participate in Amazon Transparency
LAKE MARY, Fla., March 20, 2024 /PRNewswire/ -- VerifyMe, Inc. (NASDAQ: VRME) together with its subsidiaries, Trust Codes Global Limited (""Trust Codes Global"") and ...",Le Lézard,Logistics,Singapore
"Ethical Frameworks, Global Cooperation & AI Governance","Ethical Frameworks, Global Cooperation & AI Governance
An insightful exploration into the impact of AI on the global workforce, governance, surveillance, and warfare, backed by thorough fact-checking and research Artificial Intelligence (AI) and automation are reshaping global politics, economies, and ...",Kashmir Reader,Logistics,Singapore
In Defence of the Nigerian Economy,"In Defence of the Nigerian Economy
Independent Media and Policy Initiative (IMPI), chaired by Chief Niyi Akinsiju, profiles some of Nigeria's companies thriving against all odds as evidence of the country's innate economic",Daily Independent on MSN.com,Logistics,Singapore
tralac Daily News,"tralac Daily News
The Southern African Development Community (SADC), in collaboration with the Namibia Revenue Agency (NamRA) convened a workshop in Windhoek, Namibia from 29th February 2024 - 1st March 2024 to validate the Draft Coordinated Border Management (CBM) National ...",tralac.org,Logistics,Singapore
Centre makes India's case to World Bank for Logistics Index ranking push,"Centre makes India's case to World Bank for Logistics Index ranking push
With the World Bank looking to incorporate more data into its decision-making process for the International Logistics Performance Index (LPI), a key indicator of ease of trade, India has made its case for a better score to the multilateral financier citing several reforms, Business Standard has learnt.",Business Standard,Logistics,Singapore
NUS sets up AI Institute to accelerate frontier AI research and boost real-world impact for public good,"NUS sets up AI Institute to accelerate frontier AI research and boost real-world impact for public good
From fortifying supply chain resilience against global disruptions and enhancing safety and resilience of energy systems to intelligent urban",AlphaGalileo,Logistics,Singapore
Singapore Airlines to suspend flights to Chengdu and Chongqing from Mar 31,"Singapore Airlines to suspend flights to Chengdu and Chongqing from Mar 31
Find out more about subscription packages here. SINGAPORE Airlines (SIA) will suspend flights to Chengdu and Chongqing from Mar 31, fewer than five months after flights to the two Chinese cities resumed. In response to queries, a SIA spokesperson said the ...",Business Times,Logistics,Singapore
FedEx Express pioneers first EV delivery from Malaysia to Singapore,"FedEx Express pioneers first EV delivery from Malaysia to Singapore
...there are many ways you can work with us to advertise your company and connect to your customers. Our team can help you dight and create an advertising campaign, in print and digital, on this website and in print magazine. We can also organize a real ...",Singapore Business Review,Logistics,Singapore
Mapletree Logistics Trust: Eyes On Portfolio Optimization And China Exposure,"Mapletree Logistics Trust: Eyes On Portfolio Optimization And China Exposure
Mapletree Logistics Trust's second biggest market is China, but its logistics market in 2024 is unfavorable. Learn why I still have Hold rating for MAPGF REIT.",Seeking Alpha,Logistics,Singapore
Looking for Passive Income? 5 Singapore Blue-Chips Paying Out Quarterly Dividends,"Looking for Passive Income? 5 Singapore Blue-Chips Paying Out Quarterly Dividends
There is more, though. Most blue-chip stocks also pay out a dependable dividend that income investors will love. We feature five Singapore blue-chip stocks that dish out quarterly dividends so ...",Yahoo Finance,Logistics,Singapore
ICA rolls out new QR code system for border checks,"ICA rolls out new QR code system for border checks
...there are many ways you can work with us to advertise your company and connect to your customers. Our team can help you dight and create an advertising campaign, in print and digital, on this website and in print magazine. We can also organize a real ...",Singapore Business Review,Logistics,Singapore
FLCT to acquire 89.9% interest in four German properties,"FLCT to acquire 89.9% interest in four German properties
...there are many ways you can work with us to advertise your company and connect to your customers. Our team can help you dight and create an advertising campaign, in print and digital, on this website and in print magazine. We can also organize a real ...",Singapore Business Review,Logistics,Singapore
Union Gas ventures into EV Charging sector with Deltrix deal,"Union Gas ventures into EV Charging sector with Deltrix deal
...there are many ways you can work with us to advertise your company and connect to your customers. Our team can help you dight and create an advertising campaign, in print and digital, on this website and in print magazine. We can also organize a real ...",Singapore Business Review,Logistics,Singapore
Pangaea Logistics Solutions: Post-Earnings Selloff Provides Buying Opportunity,"Pangaea Logistics Solutions: Post-Earnings Selloff Provides Buying Opportunity
I have covered Pangaea Logistics Solutions ... Pangaea's adjusted earnings per share of $0.16 missed analyst projections of $0.34 by a mile. The company reported an average daily time charter ...",Seeking Alpha,Logistics,Singapore
"Vistara, Air India merger receives Singapore anti-trust regulator's nod","Vistara, Air India merger receives Singapore anti-trust regulator's nod
When completed, the merger of Air India and Vistara will give Singapore Airlines 25.1 per cent stake in an enlarged Air India Group with a significant presence in all key Indian airline market ...",Business Line,Logistics,Singapore
Q4 2023 Delek Logistics Partners LP Earnings Call,"Q4 2023 Delek Logistics Partners LP Earnings Call
Please go ahead. Rosy Zuklic Good day and welcome to the Delek Logistics Partners fourth-quarter earnings conference call. Participants on today's call will include Avoca direct President ...",Yahoo Finance,Logistics,Singapore
ESR Group Shares Rise After Starwood Capital's Plans to Acquire Stake,"ESR Group Shares Rise After Starwood Capital's Plans to Acquire Stake
Shares of real-estate manager ESR Group rose sharply after an affiliate of private investment firm Starwood Capital Group agreed to acquire a stake in the Hong Kong-listed company. ESR Group's shares surged 11% on Wednesday morning to 8.62 Hong Kong ...",Morningstar,Logistics,Singapore
What's in Store for Pangaea Logistics (PANL) in Q4 Earnings?,"What's in Store for Pangaea Logistics (PANL) in Q4 Earnings?
The Zacks Consensus Estimate for fourth-quarter 2023 is currently pegged at an earnings of 44 cents per share, up 2.3% over the past 60 days. Pangaea Logistics has surpassed the Zacks Consensus ...",Yahoo Finance,Logistics,Singapore
Pangaea Logistics: Q4 Earnings Snapshot,"Pangaea Logistics: Q4 Earnings Snapshot
Earnings, adjusted for non-recurring costs, came to 16 cents per share. The maritime logistics company posted revenue of $131.9 million in the period. For the year, the company reported profit of ...",Houston Chronicle,Logistics,Singapore
More Pain Predicted For Singapore Stock Market,"More Pain Predicted For Singapore Stock Market
(RTTNews) - The Singapore stock market has tracked lower in consecutive trading days, slumping more than 20 points or 0.6 percent along the way. The Straits Times Index now sits just beneath the 3,200-point plateau and it's expected to open in the red again on Tuesday.",Nasdaq,Logistics,Singapore
Delek Logistics Partners Earnings Preview,"Delek Logistics Partners Earnings Preview
Delek Logistics Partners DKL is set to give its latest quarterly earnings report on Tuesday, 2024-02-27. Here's what investors need to know before the announcement. Analysts estimate that Delek ...",Benzinga.com,Logistics,Singapore
Pangaea Logistics Solns Earnings Preview,"Pangaea Logistics Solns Earnings Preview
Pangaea Logistics Solns PANL is set to give its latest quarterly earnings report on Wednesday, 2024-03-13. Here's what investors need to know before the announcement. Analysts estimate that ...",Benzinga.com,Logistics,Singapore
Recap: Pangaea Logistics Solns Q4 Earnings,"Recap: Pangaea Logistics Solns Q4 Earnings
Pangaea Logistics Solns PANL reported its Q4 earnings results on Wednesday, March 13, 2024 at 05:20 PM. Here's what investors need to know about the announcement. Pangaea Logistics Solns missed ...",Benzinga.com,Logistics,Singapore
Chemtrade Logistics Income Fund (TSE:CHE.UN) Has Announced A Dividend Of CA$0.055,"Chemtrade Logistics Income Fund (TSE:CHE.UN) Has Announced A Dividend Of CA$0.055
Chemtrade Logistics Income Fund's (TSE:CHE.UN) investors are due to receive a payment of CA$0.055 per share on 30th of April. The dividend yield will be 7.9% based on this payment which is still above the industry average. View our latest analysis for ...",Yahoo Finance,Logistics,Singapore
Energy Midstream Firm Delek Logistics Misses Earnings Estimates,"Energy Midstream Firm Delek Logistics Misses Earnings Estimates
Tennessee-based midstream energy master limited partnership Delek Logistics reported on Tuesday revenues and earnings per share for the fourth quarter that missed consensus estimates, due to ...",Crude Oil Prices,Logistics,Singapore
Mapletree Logistics Trust to acquire 3 logistics assets in Malaysia and Vietnam,"Mapletree Logistics Trust to acquire 3 logistics assets in Malaysia and Vietnam
...there are many ways you can work with us to advertise your company and connect to your customers. Our team can help you dight and create an advertising campaign, in print and digital, on this website and in print magazine. We can also organize a real ...",Singapore Business Review,Logistics,Singapore
Pangaea Logistics: Q4 Earnings Snapshot,"Pangaea Logistics: Q4 Earnings Snapshot
Earnings, adjusted for non-recurring costs, came to 16 cents per share. The maritime logistics company posted revenue of $131.9 million in the period. For the year, the company reported profit of ...",San Antonio Express-News,Logistics,Singapore
"Pangaea Logistics Solutions, Ltd. (PANL) Q4 2023 Earnings Call Transcript","Pangaea Logistics Solutions, Ltd. (PANL) Q4 2023 Earnings Call Transcript
At this time, I would like to welcome everyone to the Pangaea Logistics Solutions Fourth Quarter and Full Year 2023 Earnings Teleconference. Today's call is being recorded and will be available ...",Seeking Alpha,Logistics,Singapore
What's in Store for Pangaea Logistics (PANL) in Q4 Earnings?,"What's in Store for Pangaea Logistics (PANL) in Q4 Earnings?
The Zacks Consensus Estimate for fourth-quarter 2023 is currently pegged at an earnings of 44 cents per share, up 2.3% over the past 60 days. Pangaea Logistics has surpassed the Zacks Consensus ...",Nasdaq,Logistics,Singapore
"Singapore 'open to' idea of one-off rise in vehicle population, with higher usage-based charges: Chee","Singapore 'open to' idea of one-off rise in vehicle population, with higher usage-based charges: Chee
Find out more about subscription packages here. SINGAPORE is open to reviewing the idea of a one-off increase in its vehicle population, spread over a few years and accompanied by higher vehicle-usage charges to prevent congestion, said Transport Minister ...",Business Times,Logistics,Singapore
Here's what Wall Street expects from Pangaea Logistics Solutions's earnings,"Here's what Wall Street expects from Pangaea Logistics Solutions's earnings
Pangaea Logistics Solutions will be reporting earnings from the last quarter on March 13. Analysts predict earnings per share of $0.337. Follow Pangaea Logistics Solutions stock price in real-time ...",Business Insider,Logistics,Singapore
"Delek Logistics Partners LP earnings missed by $0.40, revenue fell short of estimates","Delek Logistics Partners LP earnings missed by $0.40, revenue fell short of estimates
See Delek Logistics Partners LP's stock price's past reactions to earnings here. According to InvestingPro, Delek Logistics Partners LP's Financial Health score is ""fair performance"".",Investing,Logistics,Singapore
"If EPS Growth Is Important To You, Chemtrade Logistics Income Fund (TSE:CHE.UN) Presents An Opportunity","If EPS Growth Is Important To You, Chemtrade Logistics Income Fund (TSE:CHE.UN) Presents An Opportunity
In contrast to all that, many investors prefer to focus on companies like Chemtrade Logistics Income Fund (TSE:CHE.UN), which has not only revenues, but also profits. Now this is not to say that ...",Yahoo Finance,Logistics,Singapore
Delek Logistics Partners (DKL) Q4 2023 Earnings Call Transcript,"Delek Logistics Partners (DKL) Q4 2023 Earnings Call Transcript
Please go ahead. Rosy Zuklic-- Vice President, Investor Relations and Market Intelligence Good day, and welcome to the Delek Logistics Partners fourth quarter earnings conference call ...",Yahoo Finance,Logistics,Singapore
Air India-Vistara merger gets Singapore's conditional approval,"Air India-Vistara merger gets Singapore's conditional approval
Find out more about subscription packages here. SINGAPORE'S competition watchdog said on Tuesday (Mar 5) that it has approved the merger between Tata Group-owned Air India and sister airline Vistara, a joint venture between Tata and Singapore Airlines ...",Business Times,Logistics,Singapore
"Pangaea Logistics Solutions, Ltd. (NASDAQ:PANL) Q4 2023 Earnings Call Transcript","Pangaea Logistics Solutions, Ltd. (NASDAQ:PANL) Q4 2023 Earnings Call Transcript
Pangaea Logistics Solutions, Ltd. (NASDAQ:PANL) Q4 2023 Earnings Call Transcript March 14, 2024 Pangaea Logistics Solutions, Ltd. isn't one of the 30 most popular stocks among hedge funds at the ...",Yahoo Finance,Logistics,Singapore
Closing Bell: Chemtrade Logistics Income Fund down on Friday (CHE-UN),"Closing Bell: Chemtrade Logistics Income Fund down on Friday (CHE-UN)
In market activity today, shares of Chemtrade Logistics Income Fund opened at $8.34 and closed at $8.32. It traded at a low of $8.29 to a high of $8.39. Shares eased -0.12 percent from the ...",The Globe and Mail,Logistics,Singapore
Fed says official net negative income was $114.3 billion in 2023,"Fed says official net negative income was $114.3 billion in 2023
The Federal Reserve said Tuesday that it officialy saw a net negative income of $114.3 billion in 2023, a record loss tied to expenses related to managing its short-term interest rate target. The loss last year follows $58.",Reuters on MSN.com,Logistics,Singapore
Q4 2023 Delek Logistics Partners LP Earnings Call,"Q4 2023 Delek Logistics Partners LP Earnings Call
Please go ahead. Rosy Zuklic Good day and welcome to the Delek Logistics Partners fourth-quarter earnings conference call. Participants on today's call will include Avoca direct President, Joseph Israel, EVP Operations, proving Spiegel, EVP and Chief ...",Yahoo Finance,Logistics,Singapore
"DHL Express' GoGreen Plus helps over 12,000 Asia Pacific customers in sustainable logistics","DHL Express' GoGreen Plus helps over 12,000 Asia Pacific customers in sustainable logistics
Dedicated solution allows businesses to lower Scope 3 emissions, contribute to ESG targets Meets the needs of environmentally conscious shippers SINGAPORE - Media OutReach Newswire - - In the span of one year,",Yahoo Finance,Logistics,Singapore
(Singapore) Spare Parts Logistics Market [Latest Research] |Size in 2024,"(Singapore) Spare Parts Logistics Market [Latest Research] |Size in 2024
New Research Report on Spare Parts Logistics Market which covers Market Overview, Future Economic Impact, Competition by Manufacturers, Supply (Production), and Consumption Analysis The market ...",LinkedIn,Logistics,Singapore
Chemtrade Logistics Income Fund Declares March 2024 Distribution,"Chemtrade Logistics Income Fund Declares March 2024 Distribution
We sell different types of products and services to both investment professionals and individual investors. These products and services are usually sold through license agreements or subscriptions ...",Morningstar,Logistics,Singapore
"Delek Logistics Partners, LP (DKL) Q4 2023 Earnings Call Transcript","Delek Logistics Partners, LP (DKL) Q4 2023 Earnings Call Transcript
Please go ahead. Good day, and welcome to the Delek Logistics Partners fourth quarter earnings conference call. Participants on today's call will include Avigal Soreq, President; Joseph Israel ...",Seeking Alpha,Logistics,Singapore
Quilter PLC Announces Significant Stake in Abrdn European Logistics Income PLC,"Quilter PLC Announces Significant Stake in Abrdn European Logistics Income PLC
According to the disclosure, Quilter PLC directly controls 25,154,950 shares of Abrdn European Logistics Income PLC, representing a 6.10% interest. This position was held as of March 15, 2024 ...",South African Official News on MSN.com,Logistics,Singapore
Dell reduces workforce as part of broader cost cuts,"Dell reduces workforce as part of broader cost cuts
DELL Technologies reduced its workforce as part of a broader initiative to cut costs that included limiting external hiring and employee reorganisations, it said in a filing on Monday (Mar 25). Read more at The Business Times.",Business Times,Logistics,Singapore
