Title,Content,Site-Name,Sector,Country
4 Singapore REITs with Dividend Yields Higher Than the CPF Ordinary Account and Singapore Savings Bonds,"4 Singapore REITs with Dividend Yields Higher Than the CPF Ordinary Account and Singapore Savings Bonds
Looking to earn higher returns than your CPF OA or SSB? These four REITs will provide you with that opportunity. The post 4 Singapore REITs with Dividend Yields Higher Than the CPF Ordinary Account and Singapore Savings Bonds appeared first on The Smart Investor.",Yahoo Finance,Logistics,Singapore
3 Singapore REITs That Recently Conducted Acquisitions to Increase Their DPU,"3 Singapore REITs That Recently Conducted Acquisitions to Increase Their DPU
Here are three REITs that conducted DPU-accretive acquisitions recently. The post 3 Singapore REITs That Recently Conducted Acquisitions to Increase Their DPU appeared first on The Smart Investor.",Yahoo Finance,Logistics,Singapore
SingPost sets three-year deadline for transformation into a logistics player,"SingPost sets three-year deadline for transformation into a logistics player
Dividend payout will be lowered to 30 to 50 per cent of underlying net profit for FY2024 to 2025 Read more at straitstimes.com.",The Straits Times,Logistics,Singapore
Ninja Van Holding Off on IPO Plans Until Profitability Improves,"Ninja Van Holding Off on IPO Plans Until Profitability Improves
Logistics provider Ninja Van has put plans for a stock market debut on the back burner, the latest sign of tech startups' struggles with falling valuations across the industry.",Bloomberg L.P.,Logistics,Singapore
FLCT to acquire 89.9% interest in 4 logistics assets in Germany from sponsor for $189 million,"FLCT to acquire 89.9% interest in 4 logistics assets in Germany from sponsor for $189 million
The acquisition is expected to be distribution per unit and net asset value accretive to the Reit. Read more at straitstimes.com.",The Straits Times,Logistics,Singapore
Blitz Raises Additional $1.6 Million in Oversubscribed Seed Extension Funding to Accelerate AI and EV Logistics Expansion Across Indonesia,"Blitz Raises Additional $1.6 Million in Oversubscribed Seed Extension Funding to Accelerate AI and EV Logistics Expansion Across Indonesia
JAKARTA, Indonesia, SINGAPORE and KUALA LUMPUR ... focusing on maximising driver income and job security while reducing the logistics industry's carbon footprint. As Blitz rapidly expands within Indonesia and sets its sights on SEA, plans include trading ...",Yahoo Finance,Logistics,Singapore
UPS expands operations in the Phillipines,"UPS expands operations in the Phillipines
Package carrier and supply chain solution provider UPS Inc. will expand its operations in the Philippines, taking the value of its total investment commitments in Asia Pacific to over $250 million since the start of 2023, the company said Thursday.",DC Velocity,Logistics,Singapore
Expert: Widening of service tax exemption scope for logistics sector a good sign,"Expert: Widening of service tax exemption scope for logistics sector a good sign
The widening of the 6% service tax exemption scope for the logistics sector is vital for Malaysia's vision of becoming the Asean transshipment hub, opined Datuk Seri Dr Michael Tio.",The Star,Logistics,Singapore
Daiwa House Logistics Trust maintains DPU S$0.0261 for H2,"Daiwa House Logistics Trust maintains DPU S$0.0261 for H2
DAIWA House Logistics Trust's (DHLT) distribution per unit (DPU) remained unchanged for the second half ended Dec 31, 2023, at 2.61 Singapore cents ... yen (S$28 million), supported by higher rental income due to a rise in occupancy, coupled with ...",Business Times,Logistics,Singapore
UPS Expands in Asia With Hub at Clark Airport in the Philippines,"UPS Expands in Asia With Hub at Clark Airport in the Philippines
Considering the fact that UPS has been doing business in the Philippines hub for more than 25 years, the new hub is expected to help UPS enhance its portfolio of integrated express, supply chain and healthcare logistics services. Additionally, UPS ...",MSN,Logistics,Singapore
Kuehne + Nagel to Buy Asia-Pacific Logistics Provider City Zone Express,"Kuehne + Nagel to Buy Asia-Pacific Logistics Provider City Zone Express
Singapore, Vietnam, Thailand, and China. The Swiss logistics company also announced earnings Friday, reporting a net profit of 283 million Swiss francs ($320 million) in the final quarter of 2023 ...",MSN,Logistics,Singapore
Looking for Passive Income? 5 Singapore Blue-Chips Paying Out Quarterly Dividends,"Looking for Passive Income? 5 Singapore Blue-Chips Paying Out Quarterly Dividends
Mapletree Logistics Trust ... Singapore Exchange Limited, or SGX, is Singapore's sole stock exchange operator. The bourse operator reported its fiscal 2024 first half (1H FY2024) earnings recently. Revenue rose 3.6% year on year to S$592.2 million ...",thesmartinvestor,Logistics,Singapore
Buy Rating on Mapletree Logistics Trust: Resilience Amidst Chinese Market Challenges,"Buy Rating on Mapletree Logistics Trust: Resilience Amidst Chinese Market Challenges
Jonathan Koh, an analyst from UOB Kay Hian, maintained the Buy rating on Mapletree Logistics (MAPGF - Research Report). The associated",Business Insider,Logistics,Singapore
3 Singapore REITs increased their DPUs,"3 Singapore REITs increased their DPUs
Mapletree Logistics Trust, or MLT ... See also 10 ways to start passive income investing to grow your money in Singapore This move enhances DCR's stake in a cutting-edge facility and promises to elevate its DPU by 3.2%. Additionally, with the facility ...",The Independent Singapore on MSN.com,Logistics,Singapore
FLCT to acquire 89.9% stake in 4 logistics properties from S$188.9M property purchase,"FLCT to acquire 89.9% stake in 4 logistics properties from S$188.9M property purchase
The property purchase worth S$188.9M brings substantial assets into its portfolio, enhancing its position in the logistics and industrial sector",The Independent Singapore on MSN.com,Logistics,Singapore
Where Will Sea Limited Stock Be in 5 Years?,"Where Will Sea Limited Stock Be in 5 Years?
The Singapore-based company ... in this area by expanding its logistics network, opening five new sorting centers and 385 new, first and last-mile sorting centers in the region. Additionally, on the fourth-quarter 2023 earnings call, the company announced ...",MSN,Logistics,Singapore
Ship lost power before crashing into bridge; 6 still missing,"Ship lost power before crashing into bridge; 6 still missing
A major bridge in Baltimore collapsed after being hit by a freighter at about 1:30 a.m. Tuesday, sending at least eight people from a construction crew into the water as a large section of the bridge",The Day,Logistics,Singapore
Cover Story 1: Preparing Capital A for take-off,"Cover Story 1: Preparing Capital A for take-off
This article first appeared in The Edge Malaysia Weekly on March 4, 2024 - March 10, 2024 PRIOR to running an airline, Tan Sri Tony Fernandes was known as an executive with an international recording company.",The Edge on MSN.com,Logistics,Singapore
"Director denied pay raise helps himself to over S$53,000 from company accounts, gets jail","Director denied pay raise helps himself to over S$53,000 from company accounts, gets jail
SINGAPORE: A director of several linked companies ... He handled company operations such as logistics, merchandising, retail operations, technology and finance. He was entrusted with the three ...",Channel NewsAsia Singapore,Logistics,Singapore
Live news: Cosco subsidiary cites weak global demand as profits plummet,"Live news: Cosco subsidiary cites weak global demand as profits plummet
The US will bring a UN security council resolution calling for an immediate ceasefire in Gaza of at least six weeks as part of a hostage deal for a vote on Friday, US officials said.",The Financial Times,Logistics,Singapore
FLCT to acquire 89.9% stake in 4 logistics properties from S$188.9M property purchase,"FLCT to acquire 89.9% stake in 4 logistics properties from S$188.9M property purchase
SINGAPORE: Frasers Logistics & Commercial Trust (FLCT ... is 4.4 years based on gross rental income (GRI). To finance the purchase, FLCT plans to utilise external debt financing.",The Independent Singapore,Logistics,Singapore
PSA International sees profit fall amid 'challenging market conditions',"PSA International sees profit fall amid 'challenging market conditions'
Company says it will continue to focus on expanding its core port business despite uncertainty in global trade",TradeWinds,Logistics,Singapore
SIA Group flies 28.2% more passengers in February; Sats makes acquisition in Sweden,"SIA Group flies 28.2% more passengers in February; Sats makes acquisition in Sweden
FLAG carrier Singapore Airlines (SIA) carried 3.1 million passengers on a group level in February, up 28.2 per cent from a year ago, it said in its operating results filed to the bourse on Friday (Mar 15).",Business Times,Logistics,Singapore
Linklogis Announces 2023 Annual Results: Maintaining the Largest Market Share in China for 4 Consecutive Years,"Linklogis Announces 2023 Annual Results: Maintaining the Largest Market Share in China for 4 Consecutive Years
Linklogis announced a new shareholder return plan, intending to enhance capital returns to shareholders through cash dividends and share repurchases. The board of directors of Linklogis proposes to pay a special dividend of HK$0.",Business Insider,Logistics,Singapore
Unlock AI Profits: How QCOM Stock Could Be Your Next Big Win,"Unlock AI Profits: How QCOM Stock Could Be Your Next Big Win
After all, QCOM stock allows you to participate in the artificial intelligence hardware market's growth, but without chasing a stock that already went parabolic.    With Qualcomm stock you'll get a decent dividend and exposure to a consistent earnings winner.",Investorplace News on MSN.com,Logistics,Singapore
"SIA Group flies 3.1 million passengers in February, up 28.2% from a year ago","SIA Group flies 3.1 million passengers in February, up 28.2% from a year ago
Stronger e-commerce flows also boosted SIA's cargo carriage to 432.3 million tonne-km, a year-on-year increase of 12.9%. Read more at straitstimes.com.",The Straits Times,Logistics,Singapore
"Singapore employers face talent shortage across all industries, women candidates in demand: Survey","Singapore employers face talent shortage across all industries, women candidates in demand: Survey
SINGAPORE: Singapore employers face talent shortages across all industries. The latest survey by ManpowerGroup,",The Independent Singapore,Logistics,Singapore
The mysterious rise of the Chinese ecommerce giant behind Temu,"The mysterious rise of the Chinese ecommerce giant behind Temu
Its finances are a black box and its operations shrouded in secrecy, but PDD's extraordinary growth has made it a darling of Wall Street",The Financial Times,Logistics,Singapore
"CMS Info Systems hires former Mphasis, Byju's executive to head operations","CMS Info Systems hires former Mphasis, Byju's executive to head operations
Puneet Bhirani will join CMS Info Systems as its president of operations. Before this, was the COO at Byjus for two years building and managing the hybrid learning business across 300+ centres.",Indiatimes,Logistics,Singapore
Accenture plc (NYSE:ACN) Q2 2024 Earnings Call Transcript,"Accenture plc (NYSE:ACN) Q2 2024 Earnings Call Transcript
Accenture plc (NYSE:ACN) Q2 2024 Earnings Call Transcript March 21 ... in marketing and customer experience with Rabbit's Tale in Thailand and [GIC] (ph) in Singapore, helping clients in Indonesia, capitalize on their fast-growing digital economy.",InvestingChannel on MSN.com,Logistics,Singapore
How Hard Is It To Move Your Business Abroad?,"How Hard Is It To Move Your Business Abroad?
Delve into the process of moving your business abroad and explore ways to facilitate a seamless transition when embarking on this adventure.",TechRound,Logistics,Singapore
3 Stocks Under $10 That Wall Street Sees More Than 100% Upside This Year,"3 Stocks Under $10 That Wall Street Sees More Than 100% Upside This Year
Since March 2023, the Dow Jones Industrial Average has surged from 31,800 to 38,900. During that 12-month stretch, some stocks, like Nvidia (NASDAQ: NVDA), have quadrupled, while others, like SunPower Corp.",24/7 Wall St on MSN.com,Logistics,Singapore
Live news: Russia targets Ukrainian energy in large-scale missile attack,"Live news: Russia targets Ukrainian energy in large-scale missile attack
Now the enemy is carrying out the largest-scale attack on the Ukrainian energy industry in recent times,"" said energy minister German Galushchenko. ""The goal is not just to damage, but to try again, like last year,",The Financial Times,Logistics,Singapore
Singapore Shipping Corp. Ltd.,"Singapore Shipping Corp. Ltd.
1 Day S19 0.00% DJIA 0.61% Russell 2K 0.65% Transportation/Logistics -1.21%",Wall Street Journal,Logistics,Singapore
Top Two Spot Occupied By Indian Firms In FT's Asia Pacific Top 500 High-Growth List,"Top Two Spot Occupied By Indian Firms In FT's Asia Pacific Top 500 High-Growth List
South Korea emerged as the leader in the number of high-growth companies, boasting 123 firms, followed by Japan and Singapore, with 101 and 93 companies, respectively",abp LIVE on MSN.com,Logistics,Singapore
Hong Kong shipping and logistics,"Hong Kong shipping and logistics
US electronic payment platform operator PayCargo is teaming up with local firm Autotoll to offer its solution to the logistics industry ... measures to boost income, cut expenditures and develop ...",scmp.com,Logistics,Singapore
FLCT to acquire 89.9% interest in portfolio of four properties from FPL at agreed property purchase price of $188.9 mil,"FLCT to acquire 89.9% interest in portfolio of four properties from FPL at agreed property purchase price of $188.9 mil
(FLCT) has agreed to acquire an 89.9% stake in the equity interests in the property-owning companies which hold four logistics properties located ... in a timely manner to secure additional income stream from the L&I sector,"" she adds.",The Edge Singapore,Logistics,Singapore
"If You Invested $1000 in Reliance Steel a Decade Ago, This is How Much It'd Be Worth Now","If You Invested $1000 in Reliance Steel a Decade Ago, This is How Much It'd Be Worth Now
How much a stock's price changes over time is a significant driver for most investors. Not only can price performance impact your portfolio, but it can help you compare investment results across sectors and industries as well.",Yahoo Finance,Logistics,Singapore
OWNDAYS Singapore softens tax hike impact on consumers,"OWNDAYS Singapore softens tax hike impact on consumers
GM says they cut SG$20 (US$14.95) in over 200 designs and retained the prices across the rest of the products. As Singaporeans met 2024 with a goods and services tax (GST) increase to 9%, eyewear brand OWNDAYS Singapore decided to cut SG$20 (US$14.",Retail Asia on MSN.com,Logistics,Singapore
Live news: Belgian PM says EU leaders have demanded that violence in Gaza 'stops right now',"Live news: Belgian PM says EU leaders have demanded that violence in Gaza 'stops right now'
Belgian's prime minister said EU leaders have made ""extremely clear"" demands about the war in Gaza in statements agreed late on Thursday. ""We finally have a unified position that is extremely clear. Demanding that the violence stops right now .",The Financial Times,Logistics,Singapore
Q4 2023 Identiv Inc Earnings Call,"Q4 2023 Identiv Inc Earnings Call
Jaeson Schmidt; Analyst; Lake Street Capital Markets Michael Piccolo; Analyst; Imperial Capital",Yahoo Finance,Logistics,Singapore
Policy coordination can boost e-commerce across the Asia Pacific region,"Policy coordination can boost e-commerce across the Asia Pacific region
Supported by a growing middle class, widespread internet-and-mobile adoption and a digital payments revolution, e-com is booming in the region. What we need now is an APAC forum led by India for regional cooperation and policy harmonization that would work to the benefit of sellers and buyers alike.",Mint,Logistics,Singapore
Buying This Super Stock at $59 Could Be Like Buying Amazon in 2014,"Buying This Super Stock at $59 Could Be Like Buying Amazon in 2014
Sea is based in Singapore, and it serves Southeast Asian markets like ... Like Amazon, Shopee is focusing heavily on reducing logistics costs and improving delivery speeds at the moment. In the fourth quarter of 2023, management said the company lowered ...",MSN,Logistics,Singapore
CLAS and CLCT appoint new chairmen,"CLAS and CLCT appoint new chairmen
Bob Tan will step down from his position as chairman of the managers of CLAS after having served since 2016. Tan was also the chairman of CLAS's nominating and remuneration committee in 2021. Tan will retire from the boards of CLAS after its upcoming annual general meeting (AGM) in April.",The Edge Singapore,Logistics,Singapore
The future is now for skilling up as S'pore ages even as tech advances: ST-BT roundtable,"The future is now for skilling up as S'pore ages even as tech advances: ST-BT roundtable
With such changes taking place, workers are feeling the pressure, and some may have concerns about job security. Read more at straitstimes.com.",The Straits Times,Logistics,Singapore
77% of investment in Indian real estate in 2019-23 by foreigners: Report,"77% of investment in Indian real estate in 2019-23 by foreigners: Report
Foreign inflows comprised 77 per cent of the total institutional investment in Indian real estate between 2019 and 2023, said a report on Wednesday, marking ""continued confidence"" in the sector. The average annual total investment in the period was $5.",Business Standard,Logistics,Singapore
Business model reinvention a priority for all retailers,"Business model reinvention a priority for all retailers
Given the current economic climate, how is inflation influencing consumer spending behaviours in the retail sector, and what strategies should retailers adopt to address these changes both in Vietnam and globally?",Vietnam Investment Reviev,Logistics,Singapore
SATS Group invests SG$61 million in new facility to serve ready-to-eat market,"SATS Group invests SG$61 million in new facility to serve ready-to-eat market
The international foods solutions facility in Bengaluru to serve as the central kitchen for the company's newly launched RTE vertical in India",Forbes India,Logistics,Singapore
Hyphens Pharma licenses Wynzora(R) Cream for ASEAN countries from MC2 Therapeutics,"Hyphens Pharma licenses Wynzora(R) Cream for ASEAN countries from MC2 Therapeutics
Cream for ASEAN countries from MC2 Therapeutics PR Newswire SINGAPORE, March 12, 2024 -- Wynzora(R) Cream is approved",MarketWatch,Logistics,Singapore
Live news: Tory donor Frank Hester under police investigation,"Live news: Tory donor Frank Hester under police investigation
Hong Kong-listed shares in Chinese electric vehicle maker Li Auto dropped 7 per cent on Friday, after the Tesla rival slashed its January-March sales volume forecast due to lower-than-expected order intake.",The Financial Times,Logistics,Singapore
Starwood Capital Enters into Partnership with ESR Group Co-Founders to Acquire 10.7% Ownership Stake,"Starwood Capital Enters into Partnership with ESR Group Co-Founders to Acquire 10.7% Ownership Stake
Starwood Capital Group (""Starwood Capital"" or ""the Firm""), a leading global private investment firm focused on real estate, today announced that a controlled affiliate has agreed to acquire a 10.7% equity stake in ESR Group (""ESR"" or ""the Company"") in a structured transaction alongside ESR Co-Founders,",Yahoo Finance,Logistics,Singapore
FFM lauds govt's service tax exemption on logistics sector business-to-business services,"FFM lauds govt's service tax exemption on logistics sector business-to-business services
The Federation of Malaysian Manufacturers (FMM) has commended the government for expanding its service tax exemption to logistics services business-to-business (B2B) transactions, which would help reduce instances of cascading tax effects or double taxation.",The Edge on MSN.com,Logistics,Singapore
Boeing (BA) Wins Contract to Aid KC-135 Tanker Jet Program,"Boeing (BA) Wins Contract to Aid KC-135 Tanker Jet Program
The Boeing Company (BA) recently secured a contract involving its KC-135 refueling tanker aircraft. The award has been offered by the Defense Logistics Agency Aviation, Oklahoma City, OK. Details of the Deal Valued at $32.",Zacks.com on MSN.com,Logistics,Singapore
Could Sea Limited Stock Help You Become a Millionaire?,"Could Sea Limited Stock Help You Become a Millionaire?
Sea Limited (NYSE: SE) minted a lot of millionaires in the first four years after its initial public offering (IPO) in October 2017. The Singapore-based e-commerce and gaming comp",The Motley Fool on MSN.com,Logistics,Singapore
Qianhai's evolution into a dynamic engine of economic growth,"Qianhai's evolution into a dynamic engine of economic growth
One of the fastest-growing and most profitable zones in China has attracted leading service providers from around the world",scmp.com,Logistics,Singapore
TikTok effect? GoTo to pare Tokopedia's India operations after deal with China's ByteDance,"TikTok effect? GoTo to pare Tokopedia's India operations after deal with China's ByteDance
ByteDance's TikTok recently bought a controlling stake in GoTo's e-commerce entity Tokopedia, which runs its major backend operations from India. Given the Chinese investor's troubled history with local authorities,",moneycontrol.com,Logistics,Singapore
Live news: European stocks slip from record high as FTSE 100 reapproaches peak,"Live news: European stocks slip from record high as FTSE 100 reapproaches peak
European stocks slipped from a record closing high, while London's FTSE 100 closed out its biggest weekly gain since September. The UK benchmark closed 0.6 per cent higher on Friday and now sits about 1 per cent below its record closing high from 13 months ago.",The Financial Times,Logistics,Singapore
"Huationg Global reports FY2023 earnings of $14.3 mil, 39.7% higher y-o-y","Huationg Global reports FY2023 earnings of $14.3 mil, 39.7% higher y-o-y
During the year, all segments - except inland logistics support service income - rose on a y-o-y basis. Gross profit was up by 27.3% y-o-y at $45.7 million. Profit before income tax was up by 46.0% y-o-y at $17.6 million. A final dividend of 0.5 cents ...",The Edge Singapore,Logistics,Singapore
CapitaLand Investment Limited: CapitaLand secures European Central Bank as new anchor tenant at Gallileo,"CapitaLand Investment Limited: CapitaLand secures European Central Bank as new anchor tenant at Gallileo
SINGAPORE and FRANKFURT, Germany, March 12, 2024 /PRNewswire/ -- CapitaLand Integrated Commercial Trust Management Limited (CICTML), the manager of CapitaLand Integrated Commercial Trust (CICT",Finanznachrichten,Logistics,Singapore
Starwood Capital Group: Starwood Capital Enters into Partnership with ESR Group Co-Founders to Acquire 10.7% Ownership Stake,"Starwood Capital Group: Starwood Capital Enters into Partnership with ESR Group Co-Founders to Acquire 10.7% Ownership Stake
Starwood Capital Group (""Starwood Capital"" or ""the Firm""), a leading global private investment firm focused on real estate, today announced that a controlled",Finanznachrichten,Logistics,Singapore
"FOREIGN INVESTMENTS WORTH RM281.5 BLN APPROVED IN 2022-2023 TO CREATE 98,725 JOBS","FOREIGN INVESTMENTS WORTH RM281.5 BLN APPROVED IN 2022-2023 TO CREATE 98,725 JOBS
KUALA LUMPUR, March 20 (Bernama) -- A total of 898 foreign investment projects valued at RM281.5 billion have been approved in the manufacturing and services sectors from 2022 to 2023, said Deputy Minister of Investment, Trade and Industry Liew Chin Tong.",bernama,Logistics,Singapore
Live news: Shares of CK Asset Holdings fall while Henderson Land climbs,"Live news: Shares of CK Asset Holdings fall while Henderson Land climbs
The logistics group, a bellwether for global growth, forecast adjusted earnings of $17.25 to $18.25 a share for the fiscal year, up from a prior forecast made in December, when it warned demand was slowing. In its third quarter, FedEx reported $879mn in ...",The Financial Times,Logistics,Singapore
The best is yet to come,"The best is yet to come
Meanwhile, its Southeast Asian counterparts were adjudged as some of the best, with Noi Bai International Airport in Vietnam and Changi Airport in Singapore being ranked ... San Miguel Holdings Corp., RMM Asian Logistics Inc., RLW Aviation Development ...",philstar.com,Logistics,Singapore
Hyphens Pharma International Limited: Hyphens Pharma licenses Wynzora® Cream for ASEAN countries from MC2 Therapeutics,"Hyphens Pharma International Limited: Hyphens Pharma licenses Wynzora® Cream for ASEAN countries from MC2 Therapeutics
Wynzora® Cream is approved and marketed in Italy, Germany, Spain, the United Kingdom, and the United States.SINGAPORE, March 12, 2024 /PRNewswire/ -- Hyphens Pharma International Limited (""Hyphens",Finanznachrichten,Logistics,Singapore
Cultivating diverse grounds for economic growth,"Cultivating diverse grounds for economic growth
The Philippine Economic Zone Authority (PEZA) is a government agency in the country, attached to the Department of Trade and Industry (DTI), that is responsible in promoting investments, extending assistance,",BusinessWorld,Logistics,Singapore
4 Singapore REITs with Dividend Yields Higher Than Your CPF Ordinary Account,"4 Singapore REITs with Dividend Yields Higher Than Your CPF Ordinary Account
However, the CPF Ordinary Account (OA), which can be used for share inv",thefinance,Logistics,Singapore
